16:49:50.461938 IP 10.0.2.15.ssh > 10.0.2.2.36856: Flags [P.], seq 2934727719:2934727755, ack 6726763, win 62780, length 36
16:49:50.462180 IP 10.0.2.15.ssh > 10.0.2.2.36856: Flags [P.], seq 36:72, ack 1, win 62780, length 36
16:49:50.462347 IP 10.0.2.2.36856 > 10.0.2.15.ssh: Flags [.], ack 36, win 65535, length 0
16:49:50.462348 IP 10.0.2.2.36856 > 10.0.2.15.ssh: Flags [.], ack 72, win 65535, length 0
16:49:50.462511 IP 10.0.2.15.ssh > 10.0.2.2.36856: Flags [P.], seq 72:108, ack 1, win 62780, length 36
16:49:50.462764 IP 10.0.2.2.36856 > 10.0.2.15.ssh: Flags [.], ack 108, win 65535, length 0
16:49:50.462814 IP 10.0.2.15.ssh > 10.0.2.2.36856: Flags [P.], seq 108:144, ack 1, win 62780, length 36
16:49:50.463026 IP 10.0.2.2.36856 > 10.0.2.15.ssh: Flags [.], ack 144, win 65535, length 0
16:49:51.484455 IP 10.0.2.15.57755 > 10.0.2.3.domain: 44745+ [1au] PTR? 2.2.0.10.in-addr.arpa. (50)
16:49:51.493020 IP 10.0.2.3.domain > 10.0.2.15.57755: 44745 1/0/1 PTR 10.0.2.2. (72)
16:49:51.494610 IP 10.0.2.15.32811 > 10.0.2.3.domain: 14655+ [1au] PTR? 15.2.0.10.in-addr.arpa. (51)
16:49:51.497608 IP 10.0.2.3.domain > 10.0.2.15.32811: 14655 1/0/1 PTR 10.0.2.15. (74)
16:49:52.506687 IP 10.0.2.15.58955 > 10.0.2.3.domain: 17531+ [1au] PTR? 3.2.0.10.in-addr.arpa. (50)
16:49:52.517606 IP 10.0.2.3.domain > 10.0.2.15.58955: 17531 1/0/1 PTR 10.0.2.3. (72)
16:50:08.445518 IP6 vagrant > ip6-allrouters: ICMP6, router solicitation, length 16
16:51:35.083765 IP 10.0.2.2.37352 > 10.0.2.15.ssh: Flags [S], seq 42944001, win 65535, options [mss 1460], length 0
16:51:35.083866 IP 10.0.2.15.ssh > 10.0.2.2.37352: Flags [S.], seq 4047863064, ack 42944002, win 64240, options [mss 1460], length 0
16:51:35.084137 IP 10.0.2.2.37352 > 10.0.2.15.ssh: Flags [.], ack 1, win 65535, length 0
16:51:35.092377 IP 10.0.2.2.37352 > 10.0.2.15.ssh: Flags [P.], seq 1:42, ack 1, win 65535, length 41
16:51:35.092414 IP 10.0.2.15.ssh > 10.0.2.2.37352: Flags [.], ack 42, win 64199, length 0
16:51:35.106865 IP 10.0.2.15.ssh > 10.0.2.2.37352: Flags [P.], seq 1:42, ack 42, win 64199, length 41
16:51:35.107228 IP 10.0.2.2.37352 > 10.0.2.15.ssh: Flags [.], ack 42, win 65535, length 0
16:51:35.107547 IP 10.0.2.2.37352 > 10.0.2.15.ssh: Flags [P.], seq 42:1554, ack 42, win 65535, length 1512
16:51:35.107563 IP 10.0.2.15.ssh > 10.0.2.2.37352: Flags [.], ack 1554, win 62780, length 0
16:51:35.109062 IP 10.0.2.15.ssh > 10.0.2.2.37352: Flags [P.], seq 42:1098, ack 1554, win 62780, length 1056
16:51:35.109401 IP 10.0.2.2.37352 > 10.0.2.15.ssh: Flags [.], ack 1098, win 65535, length 0
16:51:35.116353 IP 10.0.2.2.37352 > 10.0.2.15.ssh: Flags [P.], seq 1554:1602, ack 1098, win 65535, length 48
16:51:35.116377 IP 10.0.2.15.ssh > 10.0.2.2.37352: Flags [.], ack 1602, win 62780, length 0
16:51:35.126930 IP 10.0.2.15.ssh > 10.0.2.2.37352: Flags [P.], seq 1098:1606, ack 1602, win 62780, length 508
16:51:35.127332 IP 10.0.2.2.37352 > 10.0.2.15.ssh: Flags [.], ack 1606, win 65535, length 0
16:51:35.134200 IP 10.0.2.2.37352 > 10.0.2.15.ssh: Flags [P.], seq 1602:1618, ack 1606, win 65535, length 16
16:51:35.134254 IP 10.0.2.15.ssh > 10.0.2.2.37352: Flags [.], ack 1618, win 62780, length 0
16:51:35.137676 IP 10.0.2.2.37352 > 10.0.2.15.ssh: Flags [P.], seq 1618:1662, ack 1606, win 65535, length 44
16:51:35.137720 IP 10.0.2.15.ssh > 10.0.2.2.37352: Flags [.], ack 1662, win 62780, length 0
16:51:35.138030 IP 10.0.2.15.ssh > 10.0.2.2.37352: Flags [P.], seq 1606:1650, ack 1662, win 62780, length 44
16:51:35.138313 IP 10.0.2.2.37352 > 10.0.2.15.ssh: Flags [.], ack 1650, win 65535, length 0
16:51:35.138515 IP 10.0.2.2.37352 > 10.0.2.15.ssh: Flags [P.], seq 1662:1730, ack 1650, win 65535, length 68
16:51:35.147917 IP 10.0.2.15.ssh > 10.0.2.2.37352: Flags [P.], seq 1650:1702, ack 1730, win 62780, length 52
16:51:35.148366 IP 10.0.2.2.37352 > 10.0.2.15.ssh: Flags [.], ack 1702, win 65535, length 0
16:51:35.154642 IP 10.0.2.2.37352 > 10.0.2.15.ssh: Flags [P.], seq 1730:2382, ack 1702, win 65535, length 652
16:51:35.165868 IP 10.0.2.15.ssh > 10.0.2.2.37352: Flags [P.], seq 1702:1730, ack 2382, win 62780, length 28
16:51:35.166379 IP 10.0.2.2.37352 > 10.0.2.15.ssh: Flags [.], ack 1730, win 65535, length 0
16:51:35.166964 IP 10.0.2.2.37352 > 10.0.2.15.ssh: Flags [P.], seq 2382:2494, ack 1730, win 65535, length 112
16:51:35.212282 IP 10.0.2.15.ssh > 10.0.2.2.37352: Flags [.], ack 2494, win 62780, length 0
16:51:35.832112 IP 10.0.2.15.ssh > 10.0.2.2.37352: Flags [P.], seq 1730:2490, ack 2494, win 62780, length 760
16:51:35.832496 IP 10.0.2.2.37352 > 10.0.2.15.ssh: Flags [.], ack 2490, win 65535, length 0
16:51:35.832677 IP 10.0.2.15.ssh > 10.0.2.2.37352: Flags [P.], seq 2490:2526, ack 2494, win 62780, length 36
16:51:35.832879 IP 10.0.2.2.37352 > 10.0.2.15.ssh: Flags [.], ack 2526, win 65535, length 0
16:51:35.833420 IP 10.0.2.2.37352 > 10.0.2.15.ssh: Flags [P.], seq 2494:3190, ack 2526, win 65535, length 696
16:51:35.833439 IP 10.0.2.15.ssh > 10.0.2.2.37352: Flags [.], ack 3190, win 62780, length 0
16:51:35.836052 IP 10.0.2.15.ssh > 10.0.2.2.37352: Flags [P.], seq 2526:2634, ack 3190, win 62780, length 108
16:51:35.836366 IP 10.0.2.2.37352 > 10.0.2.15.ssh: Flags [.], ack 2634, win 65535, length 0
16:51:35.841109 IP 10.0.2.15.ssh > 10.0.2.2.37352: Flags [P.], seq 2634:3070, ack 3190, win 62780, length 436
16:51:35.841459 IP 10.0.2.2.37352 > 10.0.2.15.ssh: Flags [.], ack 3070, win 65535, length 0
16:51:35.859681 IP 10.0.2.15.ssh > 10.0.2.2.37352: Flags [P.], seq 3070:3138, ack 3190, win 62780, length 68
16:51:35.860000 IP 10.0.2.2.37352 > 10.0.2.15.ssh: Flags [.], ack 3138, win 65535, length 0
16:51:38.638482 IP 10.0.2.2.37352 > 10.0.2.15.ssh: Flags [P.], seq 3190:3226, ack 3138, win 65535, length 36
16:51:38.638580 IP 10.0.2.15.ssh > 10.0.2.2.37352: Flags [.], ack 3226, win 62780, length 0
16:51:38.639419 IP 10.0.2.15.ssh > 10.0.2.2.37352: Flags [P.], seq 3138:3174, ack 3226, win 62780, length 36
16:51:38.640027 IP 10.0.2.2.37352 > 10.0.2.15.ssh: Flags [.], ack 3174, win 65535, length 0
16:51:38.802288 IP 10.0.2.2.37352 > 10.0.2.15.ssh: Flags [P.], seq 3226:3262, ack 3174, win 65535, length 36
16:51:38.802368 IP 10.0.2.15.ssh > 10.0.2.2.37352: Flags [.], ack 3262, win 62780, length 0
16:51:38.803100 IP 10.0.2.15.ssh > 10.0.2.2.37352: Flags [P.], seq 3174:3210, ack 3262, win 62780, length 36
16:51:38.803608 IP 10.0.2.2.37352 > 10.0.2.15.ssh: Flags [.], ack 3210, win 65535, length 0
16:51:39.534568 IP 10.0.2.2.37352 > 10.0.2.15.ssh: Flags [P.], seq 3262:3298, ack 3210, win 65535, length 36
16:51:39.534984 IP 10.0.2.15.ssh > 10.0.2.2.37352: Flags [P.], seq 3210:3246, ack 3298, win 62780, length 36
16:51:35.138030 IP 10.0.2.15.ssh > 10.0.2.2.37352: Flags [P.], seq 1606:1650, ack 1662, win 62780, length 44
16:51:35.138313 IP 10.0.2.2.37352 > 10.0.2.15.ssh: Flags [.], ack 1650, win 65535, length 0
16:51:35.138515 IP 10.0.2.2.37352 > 10.0.2.15.ssh: Flags [P.], seq 1662:1730, ack 1650, win 65535, length 68
16:51:35.147917 IP 10.0.2.15.ssh > 10.0.2.2.37352: Flags [P.], seq 1650:1702, ack 1730, win 62780, length 52
16:51:35.148366 IP 10.0.2.2.37352 > 10.0.2.15.ssh: Flags [.], ack 1702, win 65535, length 0
16:51:35.154642 IP 10.0.2.2.37352 > 10.0.2.15.ssh: Flags [P.], seq 1730:2382, ack 1702, win 65535, length 652
16:51:35.165868 IP 10.0.2.15.ssh > 10.0.2.2.37352: Flags [P.], seq 1702:1730, ack 2382, win 62780, length 28
16:51:35.166379 IP 10.0.2.2.37352 > 10.0.2.15.ssh: Flags [.], ack 1730, win 65535, length 0
16:51:35.166964 IP 10.0.2.2.37352 > 10.0.2.15.ssh: Flags [P.], seq 2382:2494, ack 1730, win 65535, length 112
16:51:35.212282 IP 10.0.2.15.ssh > 10.0.2.2.37352: Flags [.], ack 2494, win 62780, length 0
16:51:35.832112 IP 10.0.2.15.ssh > 10.0.2.2.37352: Flags [P.], seq 1730:2490, ack 2494, win 62780, length 760
16:51:35.832496 IP 10.0.2.2.37352 > 10.0.2.15.ssh: Flags [.], ack 2490, win 65535, length 0
16:51:35.832677 IP 10.0.2.15.ssh > 10.0.2.2.37352: Flags [P.], seq 2490:2526, ack 2494, win 62780, length 36
16:51:35.832879 IP 10.0.2.2.37352 > 10.0.2.15.ssh: Flags [.], ack 2526, win 65535, length 0
16:51:35.833420 IP 10.0.2.2.37352 > 10.0.2.15.ssh: Flags [P.], seq 2494:3190, ack 2526, win 65535, length 696
16:51:35.833439 IP 10.0.2.15.ssh > 10.0.2.2.37352: Flags [.], ack 3190, win 62780, length 0
16:51:35.836052 IP 10.0.2.15.ssh > 10.0.2.2.37352: Flags [P.], seq 2526:2634, ack 3190, win 62780, length 108
16:51:35.836366 IP 10.0.2.2.37352 > 10.0.2.15.ssh: Flags [.], ack 2634, win 65535, length 0
16:51:35.841109 IP 10.0.2.15.ssh > 10.0.2.2.37352: Flags [P.], seq 2634:3070, ack 3190, win 62780, length 436
16:51:35.841459 IP 10.0.2.2.37352 > 10.0.2.15.ssh: Flags [.], ack 3070, win 65535, length 0
16:51:35.859681 IP 10.0.2.15.ssh > 10.0.2.2.37352: Flags [P.], seq 3070:3138, ack 3190, win 62780, length 68
16:51:35.860000 IP 10.0.2.2.37352 > 10.0.2.15.ssh: Flags [.], ack 3138, win 65535, length 0
16:51:38.638482 IP 10.0.2.2.37352 > 10.0.2.15.ssh: Flags [P.], seq 3190:3226, ack 3138, win 65535, length 36
16:51:38.638580 IP 10.0.2.15.ssh > 10.0.2.2.37352: Flags [.], ack 3226, win 62780, length 0
16:51:38.639419 IP 10.0.2.15.ssh > 10.0.2.2.37352: Flags [P.], seq 3138:3174, ack 3226, win 62780, length 36
16:51:38.640027 IP 10.0.2.2.37352 > 10.0.2.15.ssh: Flags [.], ack 3174, win 65535, length 0
16:51:38.802288 IP 10.0.2.2.37352 > 10.0.2.15.ssh: Flags [P.], seq 3226:3262, ack 3174, win 65535, length 36
16:51:38.802368 IP 10.0.2.15.ssh > 10.0.2.2.37352: Flags [.], ack 3262, win 62780, length 0
16:51:38.803100 IP 10.0.2.15.ssh > 10.0.2.2.37352: Flags [P.], seq 3174:3210, ack 3262, win 62780, length 36
16:51:38.803608 IP 10.0.2.2.37352 > 10.0.2.15.ssh: Flags [.], ack 3210, win 65535, length 0
16:51:39.534568 IP 10.0.2.2.37352 > 10.0.2.15.ssh: Flags [P.], seq 3262:3298, ack 3210, win 65535, length 36
16:51:39.534984 IP 10.0.2.15.ssh > 10.0.2.2.37352: Flags [P.], seq 3210:3246, ack 3298, win 62780, length 36
16:51:39.535481 IP 10.0.2.2.37352 > 10.0.2.15.ssh: Flags [.], ack 3246, win 65535, length 0
16:51:39.635023 IP 10.0.2.2.37352 > 10.0.2.15.ssh: Flags [P.], seq 3298:3334, ack 3246, win 65535, length 36
16:51:39.635528 IP 10.0.2.15.ssh > 10.0.2.2.37352: Flags [P.], seq 3246:3282, ack 3334, win 62780, length 36
16:51:39.636066 IP 10.0.2.2.37352 > 10.0.2.15.ssh: Flags [.], ack 3282, win 65535, length 0
16:51:39.722893 IP 10.0.2.2.37352 > 10.0.2.15.ssh: Flags [P.], seq 3334:3370, ack 3282, win 65535, length 36
16:51:39.723431 IP 10.0.2.15.ssh > 10.0.2.2.37352: Flags [P.], seq 3282:3318, ack 3370, win 62780, length 36
16:51:39.724068 IP 10.0.2.2.37352 > 10.0.2.15.ssh: Flags [.], ack 3318, win 65535, length 0
16:51:40.786838 IP 10.0.2.2.37352 > 10.0.2.15.ssh: Flags [P.], seq 3370:3406, ack 3318, win 65535, length 36
16:51:40.787273 IP 10.0.2.15.ssh > 10.0.2.2.37352: Flags [P.], seq 3318:3354, ack 3406, win 62780, length 36
16:51:40.787695 IP 10.0.2.2.37352 > 10.0.2.15.ssh: Flags [.], ack 3354, win 65535, length 0
16:51:40.923567 IP 10.0.2.2.37352 > 10.0.2.15.ssh: Flags [P.], seq 3406:3442, ack 3354, win 65535, length 36
16:51:40.924116 IP 10.0.2.15.ssh > 10.0.2.2.37352: Flags [P.], seq 3354:3390, ack 3442, win 62780, length 36
16:51:40.924692 IP 10.0.2.2.37352 > 10.0.2.15.ssh: Flags [.], ack 3390, win 65535, length 0
16:51:41.023476 IP 10.0.2.2.37352 > 10.0.2.15.ssh: Flags [P.], seq 3442:3478, ack 3390, win 65535, length 36
16:51:41.024205 IP 10.0.2.15.ssh > 10.0.2.2.37352: Flags [P.], seq 3390:3426, ack 3478, win 62780, length 36
16:51:41.024795 IP 10.0.2.2.37352 > 10.0.2.15.ssh: Flags [.], ack 3426, win 65535, length 0
16:51:41.115722 IP 10.0.2.2.37352 > 10.0.2.15.ssh: Flags [P.], seq 3478:3514, ack 3426, win 65535, length 36
16:51:41.116266 IP 10.0.2.15.ssh > 10.0.2.2.37352: Flags [P.], seq 3426:3462, ack 3514, win 62780, length 36
16:51:41.116796 IP 10.0.2.2.37352 > 10.0.2.15.ssh: Flags [.], ack 3462, win 65535, length 0
16:51:41.223295 IP 10.0.2.2.37352 > 10.0.2.15.ssh: Flags [P.], seq 3514:3550, ack 3462, win 65535, length 36
16:51:41.223796 IP 10.0.2.15.ssh > 10.0.2.2.37352: Flags [P.], seq 3462:3498, ack 3550, win 62780, length 36
16:51:41.224398 IP 10.0.2.2.37352 > 10.0.2.15.ssh: Flags [.], ack 3498, win 65535, length 0
16:51:41.295706 IP 10.0.2.2.37352 > 10.0.2.15.ssh: Flags [P.], seq 3550:3586, ack 3498, win 65535, length 36
16:51:41.296227 IP 10.0.2.15.ssh > 10.0.2.2.37352: Flags [P.], seq 3498:3534, ack 3586, win 62780, length 36
16:51:41.296740 IP 10.0.2.2.37352 > 10.0.2.15.ssh: Flags [.], ack 3534, win 65535, length 0
16:51:41.435509 IP 10.0.2.2.37352 > 10.0.2.15.ssh: Flags [P.], seq 3586:3622, ack 3534, win 65535, length 36
16:51:41.436098 IP 10.0.2.15.ssh > 10.0.2.2.37352: Flags [P.], seq 3534:3570, ack 3622, win 62780, length 36
16:51:41.436543 IP 10.0.2.2.37352 > 10.0.2.15.ssh: Flags [.], ack 3570, win 65535, length 0
uc?id=0B3X9GlR6EmbnWksyTEtCM0VfaFE16:51:41.571806 IP 10.0.2.2.37352 > 10.0.2.15.ssh: Flags [P.], seq 3622:3658, ack 3570, win 65535, length 36
16:51:41.572346 IP 10.0.2.15.ssh > 10.0.2.2.37352: Flags [P.], seq 3570:3606, ack 3658, win 62780, length 36
16:51:41.572887 IP 10.0.2.2.37352 > 10.0.2.15.ssh: Flags [.], ack 3606, win 65535, length 0
16:51:42.196108 IP 10.0.2.2.37352 > 10.0.2.15.ssh: Flags [P.], seq 3658:3694, ack 3606, win 65535, length 36
16:51:42.196650 IP 10.0.2.15.ssh > 10.0.2.2.37352: Flags [P.], seq 3606:3642, ack 3694, win 62780, length 36
16:51:42.197044 IP 10.0.2.2.37352 > 10.0.2.15.ssh: Flags [.], ack 3642, win 65535, length 0

